41,better than the movies,lynn painter,4.25,85.00%,356,"2,021",romance,teen/ya,2024-06-04,2024-06-05,2.0,"i was apprehensive when i first started. as i've gotten older, books that take place in modern day high school inherently just feel cringey to me, on top of not wanting to relive high school again through the book aha. but was glad that though liz is a bit cringey, she's also cute and sentimental (maybe to a fault). 

the biggest part that was cringey or awkward to read was liz's infatuation with michael, or rather the idea of him. probably due to being tied with grief about her mom, as to why she clung to that idea and never really moved on or grew up from it. i sympathized with her and accepted this aspect of her personality because of that background detail

the whole plot of it taking so long for liz to realize what she thinks she has with michael vs what she has with wes was a journey but was fun (yet can be frustrating) to witness. but damn girl it took so long to get into her head and things to click into place. also this book does have miscommunication in the conflicts, but more so just the two characters not talking !! even though they should !! but they're silly high school teens that have bad communication skills xd

overall this book was very cute and fun and a fast read. the cringe was there but it's a level of cringe with reasoning as to why its cringe that made it tolerable/ignorable", ,
42,how to end a love story,yulin kuang,4.50,90.00%,384,"2,024",romance,fame/celebrity,2024-06-06,2024-06-10,5.0,"i started this book but then changed my mind and wanted to read fantasy so i started throne of glass, cut to a couple days ago, realizing that this ebook from the library is due very soon and i had only read a couple chapters before putting it down (not that it was bad just that i was at the time more interested in reading something else) but man, once i started, i was sucked in. i spent three nights in a row going to bed very very late and subsequently ruining my sleep schedule just because i was so sucked into reading this. 

first the premise. was very curious how it would play out and was not disappointed. the tension and almost enemies to lovers energy it had but having a more serious tragic circumstance that made them (more so helen than grant) feel so hostile to the other. 

i felt like the pacing was solid, maybe at certain points it felt a bit rushed and time was moving too fast where we would just get a simple summary of what happened in the time skip which i'm not always crazy about in books (not that i need to know everything that happens but i feel like at somewhat important or meaningful moments get cut for brevity). i liked that we got both pov's of helen and grant, but the split wasn't your traditional romance book of one chapter one pov next chapter other pov. it was very fluid and went back and forth. yes at first it was something to get used to but once i did i really enjoyed it. it was different and had that more cerebral stream of consciousness feeling to it with this style. learning about kuang's background as a screenwriter once i finished the book felt it made more sense with this choice.

i love love romance books that have roots in realism, addressing the emotional tenets of the characters since their relationship is the main plot point of the story. i feel the characterization was done well, how almost frustratingly both helen and grant were stubborn in their own ways not understanding or communicating during their issues and more specifically helen's hangups about not wanting anything love-related with grant (even though she ain't fooling anyone just silly to not realize and admit it). i felt the aspects of the asian american assimilation experience to be very relatable, the complex relationship one has with their parents, how the concept of love was a very tricky and unclear sentiment growing up and specifically in helen's case how that coupled with michelle's death created some heavy trauma and emotional complexities that only during the book she would start to tackle more. 

not to get into spoilers but i also enjoyed the ending, how things did not resolve perfectly and again had that realism of disagreements may not be resolved, especially whilst having a language/culture barrier making the circumstance all the more complicated. 

the level of spice/sex scenes in the book felt a little too much for my personal preference but i think that they all made sense and wasn't an excessive like hump fest that made no sense to the plot or character arcs, a thing that i often get annoyed by in other romance novels (ofc personal preference, like things to have meaning and contribute to the plot, rather than just to have them in a book)

overall i really enjoyed this one. how it touches on familial relationships, grief, but also growth during the process and not waiting to figure out your life once you're a ""perfect person"" with all one's baggage resolved ", ,
43,better than the prom,lynn painter,4.00,80.00%,30,"2,022",romance,teen/ya,2024-06-10,2024-06-10,1.0,they're so cute and glad to read wes' pov :) i've kinda decided not to read the second book no matter how the first two chapters i read in a teaser at the end of better than the movies bc wdymmm they break up in what feels like a marketing move just to write another book -_-, ,
44,throne of glass,sarah j. maas,4.00,80.00%,406,"2,012",fantasy,teen/ya,2024-06-06,2024-06-21,16.0,"did not realize till writing this review that it's been roughly 10 years since i read this book, crazy. despite the passage of time, along with the lengthy time it took just because i took a week or so break from reading, i still really enjoyed this book. yes, now after time i can see the cringeyness of certain lines the characters say, but the plot was good, the whole underdog (but not really) journey that celeana goes after coming from her prison, the salt mines, survival to another type of survival with the reward (with strings) of freedom. i always love a training arc in a character and maybe this was one of the early books that attributed my love for them.. hm. 

revisiting the book was nice, though because of time and me reading a lot of books since then, fading the memories of this book, most details were not new but more of a rediscovery? how all the pieces, hints, red herrings?, tease the plot in not only this book, but from what i remember of books 2-5 as well. 

overall very fun, some elements that does make it clear it is a ya fantasy novel but mostly not in a bad way. excited to continue my re-read of this series, as i have been trying to do since having more reading/story experience and reading them from an adult perspective. ", ,
45,not like other girls,meredith adamo,4.50,90.00%,448,"2,024",mystery,teen/ya,2024-06-23,2024-06-25,3.0,"i first came across this book on my goodreads feed, and requested the library ebook on a whim. i enjoyed it and loved it so much, the premise sucked me in, which reminded me how much i enjoy mystery stories and should read more of them. 

my brain is still reeling from the ending, how much the story unraveled and twisted that i was sucked in reading the last 1/3 of the book rushing to figure out what is happening. the pacing of the story was good, how things were revealed, the red herrings or even the mc just misunderstanding certain details leading us down a rabbit hole, i felt all was delivered well. no parts of the story felt dragged or filler, maybe at the end it would seem fast? but given the nature of the mystery being solved, the speed added to the rushed nature the characters felt as they were trying to figure out why maddie went missing.

the characters.. man let's just say that everyone sucks and move on haha 
but actually, the more we found out about maddie, jo, and the others, the more messed up they were, how the privileged yet very broken family lives. also just being dumb stupid naïve kids. and the human nature of being so selfish and the desperation to the point of becoming morally grey, how some characters saw their relationships for more than what they are, whether it be romanticized or transactional view of it. a very realistic understanding of high school drama, as the author addressed topics and themes beyond the typical soapy teen drama, and having these aspects not just to have them to make it a teen drama mystery but to have meaning and the characters experiences be cathartic. (if this at all makes any coherent sense aha)

i also appreciated the aspect of delving more into jo and the life leading up until maddie went missing. how in trying to figure out the reason maddie needed her help right before she went missing, jo was confronted to look at her past actions and experiences, how those affected her to the point of not even realizing the effects until years later. i felt so angry for jo about the revenge porn, but also sad how she kept justifying in her mind that all those actions done against her was her fault, her mistake for doing a, b, c, or not saying x, y, z. (EVEN THOUGH IT WASN'T !!) the delivery of these heavy topics felt it was done right, going through how girls feel and the steps of grief through those traumatic experiences. how much women yearn for friendship and love that we don't receive and how much the world screws us over. (i'm not sure where i'm going with this) but i appreciate that we not only got to see jo through the realization but also the recovery and growth from it, how she started to develop female friendships again, talking through those traumatic experiences to others. 

my brain fully hasn't processed this book to write more about it but nonetheless i really enjoyed this. i always love a mystery and trying to solve it and i should intentionally read more in the genre....", ,
46,crown of midnight,sarah j. maas,4.50,90.00%,420,"2,013",fantasy,teen/ya,2024-06-26,2024-06-28,3.0,"it's been so many books and a significant amount of time since i've read this book that i forgot most of the plot. the only part i remembered was the big twist and the events leading up to it, which when i got to the part knew instantly yet still crushed me like the first time. the bigger twist towards the end that enhances the twist i did forget though, and maybe because i was drawn into the book taking away my attention, i did not pick up on the clues like i did for how the antagonist was brought up in the first book.

this book felt like such an upgrade from the first, other than the love triangle that goes on, not much did feel like a ya novel. yes the characters are in that age range 18-20's, but because of the whole issue of solving the puzzle(s) with the king and the darkness lurking in the castle, maybe distracted me? or made the plot more interesting that my brain didn't register the love triangle elements too much. 

speaking of the love triangle, classic 2010's ya novel trope. it's not the worst depiction but also not the best, just alright and decently in there and it makes sense (sorta). i do like that we eventually step away from the love triangle and a decision (not to be specified to avoid spoilers aha) is made (sort of). i really enjoyed the relationship development with celeana and ""the others"" (chaol, dorian, nehemia) that they all get to know each other and find out more things even to their dismay. but also the lies and hidden truths that celeana goes about telling as she tries to manuver around being the newly appointed king's champion but also solving elena's riddle? hint about darkness in the castle.

overall very fun intense book. heartbreak only makes you stronger, right? celeana? oof. aha. excited to continue rereading the series, to get into more politics as this book only starts to get into it. though unfortunately i cannot access my irl copies of the rest of the series so will have to take a break until i do </3 unless my library ebooks come through lol", ,
47,let's go let's go let's go,cleo qian,3.50,70.00%,256,"2,023",contemporary,adult,2023-11-05,2024-07-01,240.0,"overall this collection of short stories was interesting especially having not only a female asian writer but also stories mostly in that perspective. but i did have to force myself to finish reading it and most of the stories were okay or didn’t feel fleshed out? and didn’t feel like a full story. the girl with double eyelids was probably my favorite of the 11 stories.

average rating: 3.39 stars
overall rating: 3.5 stars

individual thoughts/reviews:

chicken. film. youth.
probably will be a similar sentiment for all the stories but relatable story environment with the characters and circumstances. the main story seems like it was occurring within the chicken shop man telling the story? though intriguing a bit confused, like the delivery and presentation was unique but the message (at least how I interpret it) felt a beat off with this unique presentation 
3 stars

monitor world
creepy eerie made my skin crawl and probably didn’t help that i read this late at night about a creepy man who’s with a girl 10-15 years younger at least 🥴 interesting perspective on the internet world though, not strongly through the story 
2.75 stars

zeros:ones
interesting concept. not sure how the story was going and then it just ended. related to luna? i think is her name, but how she felt during the transition period in her life as she’s in a fellowship post graduation feeling lost and empty as she reflects on her relationships past and present
3.5 stars

wing and the radio
i think how the story started and how it was leading with the two perspectives i liked, but then it drifted it off only connecting in the end. and even how it connected i can accept but idk i wanted a bit more? thematically enjoyed, the feelings of being lost, similar to the previous story, even other ones too, about reflection and mixture of regret, melancholy, wistfulness, i did enjoy. a sad tone with no expected concrete ending but more like a glimpse into both of these character lives with maybe a changing point in their lives. 
3.25 stars

the girl with double eyelids
i think i liked this one the most, maybe because it was the longest story in the book, so it felt more fleshed out and could learn more the characters. the theme was eerie but realistic, and even though there was no clear explanation or resolution, xiao yun seeing the invisible tattoos as omens about the person made the story interesting.
4 stars

the virtuoso
reading about a girl aiming to be the best at piano in her state reminded me of my years playing and practicing. interesting thoughts and themes about striving to be the best, that even feeling like you were perfect, that perfection was not there, the feeling of falling short that someone’s better. 
3.75 stars

let’s go let’s go let’s go
interesting story and concept, for this i did like the more open ended ending, adds to the mystery of not only lily but also this retreat? cult-like? collective? 
3.5 stars

power and control
the concept and story was interesting how greta was spiraling in the relationship, and how we realize at the end how it connects back to the beginning of the story. curious how alchemy was a part of the story, not familiar with it but do know it in general, especially with more fantasy books. 
3.5 stars

we were here
not sure how it would go but idk it felt listless with how the mc was drifting between things figuring out what she’s doing. felt relatable to me, being in similar position. but beyond that i dunno.
3.25 stars

messages from earth
i liked that the two characters were in periods of transition, trying to figure out life while in the beginning stages of adulthood, going to college. but also the before and after? with luna and vicki, one at the start of transition and the other towards the end, separating from traditional parents. was poetic? with that theme but otherwise no other clear plot or narrative
3.5 stars

seagull village
interesting concept that i liked and felt it was executed somewhat well. also questions the concept of why the narrator? came to this village, for what purpose
3.25 stars", ,
48,chain of gold,cassandra clare,4.25,85.00%,582,"2,020",paranormal,historical,2024-07-03,2024-07-09,7.0,"was kinda approaching a book slump? or more just grieving that i couldn't continue reading the throne of glass series bc the library rentals are at least months of waiting and i don't have my physical copies waiting. which sorta explains why it took longer than expected to finish this book. but also, maybe due to it being the first in a trilogy was a slow start, at least plot wise, made it hard to be hooked onto it

but man, it's like seeing an old friend, being in the shadowhunters universe, much less with my favorite of the two main groups? with the london crowd, all now grown and reading about their kids in their late teen formative years. most of the characters felt unique, but also strongly resembling characteristics of the original london group, making sense since they are the children other than cordelia, of henry, will, jem, tessa, gideon, gabriel, cecily, charlotte, sophie, etc etc. also it was fun to see appearances of magnus bane and ragnor fell, and an ominous visit with the mention of malcolm fade (if you read dark artifices... well yeah) each of the main group felt unique and recognizable, though due to the larger group of the 6 + alstair and grace lol i always had to take a second to remember the parentage of christopher and thomas. 

there were definitely references of couple of the short stories from shadowhunters academy that i sorta remember vaguely but not enough to recall the details about the tension between alstair and the merry thieves. i could see for many people, sorta including myself that the amount of characters introduced can be overwhelming, with the carstairs, herondales, lightwoods, and fairchilds, in all their messy complicated glory. 

the plot was a slow burn for sure, as mentioned. it does make sense given it is the start to a trilogy and many of the key pieces are hidden from us or only starting to unravel at the end of this book which made me mad, to the point of the old days when i was younger reading books and chucking something in anger or frustration, knowing what was happening but the main characters be in the dark haha

i did again like i did with dark artifices, with wanting to remember details look up character bios on the wiki and spoil elements of the story with certain character details that would be revealed or hinted at, though i did stop myself from finding out more details and was still able to enjoy the story unfolding and learning how the story arrived to certain major plot points. 

seems interesting how things are set up, playing into the concept of the first shadowhunter/warlock  people with lucie and james. harkens back to clary and jace in the original series, though that was less obvious given that lucie and james have that warlock background and context. this trilogy being a direct sequel to the infernal devices is interesting and am curious how things from that first trilogy further connects to this one. 

note: man i want to strangle grace and matthew but for completely different reasons. oh also add james there too. the miscommunication is strong in this book with its relationship dynamics and though adds tension and more plot devices also makes me want to bang my head on the wall because it's so frustrating alkfjlwiefakw oh yes let's keep a secret about something that is very important but not share it to anyone and keep it to ourselves and it definitely won't go over badly by doing this.. -.-

overall. strong start to the trilogy. felt very exposition-y and felt like it dragged a bit but i can't specify on specific part that it did per say", ,
49,chain of iron,cassandra clare,4.25,85.00%,656,"2,021",paranormal,historical,2024-07-10,2024-07-15,6.0,"well. i'm still in such whiplash from that ending thinking about it and i needed a bit before i sat down to write my thoughts lol

this book really flew by for me, i think the plot was unraveling well (to my annoyance for wanting to know what was happening lol) and kept me gripped reading through, especially considering for me it's a decently hefty book at around 600+ pages. 

i enjoyed living through these characters, despite all the silly dumb annoyingly stupid things that they would do, how sometimes they were so blinded or trusting by someone else for the plot to twist into more catastrophe. especially at certain points, i did get annoyed by characters being too blinded, basically in their good nature and seeing the best in people that they would help someone to only continue to cause them pain by said person. like, james, lucie, really, we are doing this again? again the frustration that ""oh i can't tell them 'xyz' because they won't forgive me or i can't do that to them by letting them know"" and it made me want to strangle them a little or slam my head on the wall... lol :/

i am curious as to how this trilogy will wrap up and the plot lines will tie together. but overall i enjoyed it? this book but definitely some annoyances that the same character issues keep cropping up and not being resolved. like the miscommunication and secrets between the merry thieves + cordelia & lucie are just adding more and more secrets... sigh

also i hate being taunted by cordelia and james being an actual thing for it to only be ripped away by annoying little grace.. smh... lol", ,
50,mistborn: the final empire,brandon sanderson,4.25,85.00%,541,"2,006",fantasy,adult,2024-07-16,2024-07-27,12.0,"ah yes i finally decided to go into the belly of the beast and start tackling brandon sanderson books after all these years of wanting to but never got to it, and boy i wasn’t disappointed 

it definitely took a moment to get into the story, with getting used to sanderson’s writing style and all the exposition. i also did struggle in the beginning with getting attached to the characters? or moreso it was hard to grasp rooting for the characters? yes i thought they were interesting and their motivations too but maybe because of each characters’ flaw very evident in the beginning of the story made it hard to do so idk especially considering the heist-like premise which would normally hook me into the story

that being said i felt that the characters were so strong and individual/distinct, having both good and bad qualities, which i did enjoy. 

i think what continued to draw me in was the whole plot/premise, curious how these characters were gonna pull off a rebellion or sorts against a sort of god. the whole magic(?) system with metals is really fascinating, especially with how they tap into both mental and physical abilities. i also appreciate the politics with all its complications and nuances, with not just the nobility but also the inquisitors, which were like another branch of government but were significantly more powerful given they had mistborn abilities? or even beyond such. 

it took effort to not try and finish the book last night just incase the ending was a cliffhanger and i would be awake until like 4 am reeling lol. so much to say that even though i struggled a bit in the beginning to get into it, whenever i took a chunk of time to read, the chapters flew by

overall i enjoyed delving into the world of mistborn and the whole magic system and politics and social classes. knowing that this trilogy extends into a greater sanderson universe i’m very curious to how things will unfold with vin and the rest of them :)

4.25 stars", ,
51,asap,axie oh,4.00,80.00%,352,"2,024",romance,fame/celebrity,2024-07-27,2024-07-28,2.0,"this was fun to read, a nice break between reading a bunch of fantasy books and man i zipped through this. 

i think i liked this one a bit more than ""first"" book of xoxo, maybe because i got used to the characters and the group after reading the book so it was more fun coming back to these characters and getting to see nathaniel and sori get their time as the mc's

i enjoyed the arc of sori trying to find herself with realizing that she doesn't want to be a kpop singer anymore and finding a balance in her relationships both platonic with jenny and romantic with nathaniel

naturally with stories about high school/college aged kids there is a level of cringeyness coming from a person years out from college, but it felt natural and realistic to an extent and i could gloss over the second-hand embarrassment

overall very fun and happy to see these characters in this sorta sequel from xoxo. normally i'm not that crazy about second chance romance but i enjoyed how it was, maybe because they were friends despite breaking up.. and also the tension between the two increasing was exciting ", ,
