52,the maid,nita prose,2.75,55.00%,304,"2,022",mystery,contemporary,2024-07-29,2024-07-31,3.0,"i feel like i need to cleanse myself by reading mystery novels like agatha christie or arthur conan doyle or heck, even gillian flynn after reading this lmao

i was hopeful at the beginning of this book, as i enjoy mystery/crime stories but have to gotten to reading them that much. not to mention that i was charmed with molly, who i related to an extent about having a particular structure to things and having things clean. as i continued to read, molly had more characteristics that were similar to of a neurodivergent person. but i was disappointed when this was just passed off as a “quirk” and other characters saw her as robotic and odd. i was frustrated so much for her, that the author danced around this and never addresses it despite the whole backstory of being bullied when she was younger and taken advantage of by many people as the story progresses due to her lack of ability to recognize facial expressions (DESPITE this is a plot hole since that was something she has been working on since she has been growing up with gran and in the beginning of the story is able to recognize it? like huhh)

i also was under the assumption? or the premise lead me to believe that molly would be the one solving the mystery case when she didn’t, and unfortunately was dragged into things unknowingly, even though the author makes it evident for us the reader to realize that she’s swept up in helping juan manuel and rodney because of her good will and romantic interest respectively. honestly it was quite painful and frustrating to see it happen with her accepting or being blinded because of it. 

the ending wrapped up okay, though it did feel somewhat predictable and corny, but i also dislike that the final details of the crime was added almost like an afterthought in the end of the epilogue. not to mention that the reasoning of molly's actions from that epilogue make no sense going back from her as a person in her beliefs that were established at the beginning of the book. idk man this just irked me that such a major plot point is just stuffed at the very end of the epilogue with no sense of how the plot flowed with things already wrapping up. like it could've been delivered better, even if it was still at the end of the book. ", ,
53,a witch's guide to fake dating a demon,sarah hawley,3.75,75.00%,367,"2,023",romance,paranormal,2024-08-09,2024-08-13,5.0,"i needed a break of romance after going through a lot of big fantasy novels, especially as i'm slogging through brandon sanderson's well of ascension, something that i am enjoying just i don't gravitate towards reading it all the time

this was very fun and reminded me that i should try to find more light-hearted urban fantasy? romance or otherwise books. or even just paranormal characters in the real world

had some frustrations with the whole miscommunication-type conflicts, or simply just the mistrust, which understandably so given the initial circumstances, but the fact that oz and mariel circled back to this mistrust and assuming the worse without hearing out too many times for my comfort got to be a bit frustrating. wish that the resolution? of the conflict as well as the revelations felt too rushed at the end, how things were spiraling then bam crux of the issue then bam resolved, then bam last chapter everything's all good. with how the author structured things, it made sense with how it progressed, and just tacking on more chapters wouldn't necessarily fix this mild peeve i have, nor do i have a clear solution to how i would hypothetically fix this rushing to the ending issue

on the other hand, i did love the growth arc that mariel went through, the frustrating aspects of her bearing through her mother's insults, struggling to find boundaries with her through confrontation as well as realizing her supporters, and taking strength from them to face her issues head on. the confidence that grew in her was lovely to read as the story progressed, and liked how one conflict that mariel stood up for, helped her set up for the next one, with a little more and more confidence to speak up with her feelings <3 wish we got a bit more in seeing oz's growth trajectory, but maybe because it was in conjunction with mariel's but it just felt like it happened and we're at the end with him in love and standing up for himself, even though the path to here was unclear at a good chunk of times.

overall was a fun book, felt a bit rushed with the ending and how things wrapped up a bit fast, and would've wanted more mmc on-page time with personal growth", ,
54,the well of ascension,brandon sanderson,4.25,85.00%,590,"2,007",fantasy,adult,2024-08-01,2024-08-22,22.0,"i’m still mentally reeling from that ending…

i struggled a bit to continue reading in the middle of the book, as the politics were increasing. ironic, given that usually i enjoy learning about government politics, and it’s not an issue in this book, but more personally i wasn’t hooked enough to fuel through it. but in hindsight i do appreciate those elements, especially as it builds in tension and plot but also how the characters, namely elend reveal their morals and values and opinions, and how they may change or develop by the end of the book. 

speaking of, i really loved the character development of the main crew, how they changed given the circumstances of the post-coup environment of scrambling to figure out how to manage the government system and kingdom-ship as well as adjusting and adapting from the rag-tag thieving group with a heist plot to nobility and leadership positions in a monarchy. i did like that vin and elend’s relationship was more in focus with this book, accounting for the imbalances in their relationship, mistborn and not, assassin and king. we got to witness their struggles grappling somewhat unknowingly through these imbalances all while dealing with neighboring kings wanting to seize power. 

ah yes, the introduction of the unknown mistborn, that we later find out is zane. not to get into heavy spoilers, but i am curious about some things that were not addressed that may be connected to what vin heard at the end of the the book. not to mention marsh, who was absent from most of the book, only to flit in and out occasionally, which had me having more questions about what’s going on with him, especially when it seems the inquisitors are still around? but not in luthadel? 

the plot was definitely a slow burn with how conflicts were building and for the most part did enjoy that aspect. yes, i did struggle during the slow parts, similar to empire of storms, but once i was in a groove reading, i powered through multiple chapters. it did help having the library ebook deadline being due in x amount of time so i had to read x amount of chapters a day to finish in time, creating almost like a marathon environment reading this. lol

overall i did very much enjoy this book with the war politics. i’m excited to read the finale of this mistborn trilogy which perfect timing, i just got the library ebook a couple days before finishing. but i do have other rentals i need to finish first before starting aha

4.25 stars", ,
55,the game changer,lana ferguson,3.75,75.00%,400,"2,024",romance,sports,2024-08-15,2024-08-23,9.0,"brain too tired to write so later but i liked it

later:

i liked the emotional complex elements to this story, with ian’s backstory having a terrible father that’s verbally and emotionally abusive. i wish that there was more with delilah’s part, whether it be on her and jack’s parents dying when they were young or something else 

i liked having jack in the story as a character, connecting the two mc’s but also felt like he was just there? at most for comic relief and to play the brother in the brother’s best friend trope so it felt like he needed more to him as a character

overall was fun read with some emotional aspects and maybe would’ve liked either more baking or more hockey in the story but it felt like we only got a little of both", ,
56,the fake mate,lana ferguson,3.75,75.00%,372,"2,023",romance,workplace,2024-08-23,2024-08-25,3.0,"the whole premise was intriguing to me, especially as i’ve been wanting to read some paranormal romance lately and this was a little silly, light but fun to read before i go into more heavier? ish content with sally rooney and finishing the last book in the mistborn original trilogy lol

the whole omegaverse was not a surprise or new to me, maybe because in high school i read a lot of fanfiction of varying genres and universes so the omegaverse trope was familiar from the details i remember. thus said details were not offputting or surprising to read, (i.e. growling, turning into a wolf, sex-related elements specific to omegaverse) i think the author, given the circumstances handled these elements well. i was a bit concerned but that was quickly diffused during the scene where noah and mackenzie turned into wolves and reached a point where description could go on for so long before dialogue would get… interesting… with them being in wolf form. 

i think the book does what it’s meant to do, and it had enough of the fake dating (or mated in this case) that i was satisfied with my hopes of it going into this book. i do maybe wish to elevate this book more, if we got to explore mackenzie’s orphan-ness and childhood trauma, to better explain her as a character and why she’s so headstrong and independent despite the stigmas of a female omega. likewise with noah, would have liked it more if we got to explore more about noah’s standoffish nature and why he feels the need to close himself off from people until mackenzie, and have little friendships and relationships due to it. yes it would change the book tone-wise but maybe because i enjoy romance books more when they go beyond the simple romance relationship, with emotional complexities and such. but c’est la vie

despite all that i did enjoy noah and mackenzie as characters, both individually and together, their goofy, snarky natures but also the tender and sweet relationship that developed over the course of the book. i found myself chuckling and laughing outloud while reading at certain points and surprisingly! did not cringe that much on the puns and dad jokes in this book despite my general dislike and cringing of such humor. 

i probably would’ve finished this in one day but it got stretched to three as i was busy during the day and only read right before bed, to the point of falling asleep, phone in hand lmao

overall it was a fun read and a little too much sex imo but given it’s an omegaverse book the amount of sex scenes tracks. i still love fake dating as a trope and will continue to consume books that have it. ", ,
57,"beautiful world, where are you",sally rooney,4.50,90.00%,337,"2,021",contemporary,romance,2024-08-25,2024-08-31,7.0,"i feel like unpopularly, i enjoyed this book more than normal people. or maybe my perspective shifted on heavy morally grey character books so i ended up enjoying this one more because of that. 

i also really enjoyed the format of the novel, even though it was an attribute of contention later in the story, i liked that before we switch into a different perspective of the book, between alice and eileen, we get a email letter one sending to the other, giving almost a glimpse of their headspace before going into the narrative chapter

i did have to shift my mind a bit in terms of how i saw the two main ""couples,"" eileen and simon and then alice and felix, as prior to this i have been reading a couple romance novels. i was intrigued about these two pairings, though more specifically on eileen and simon, maybe because personality wise is closer in more aspects to me compared to alice and felix. but my goodness, i was about to get frustrated at these characters, stuck in their own heads, unable to communicate, or even unable to form what their feelings for each other actually are. 

but, during the reframing, i saw the beauty in the broken, how it felt very human, realistic to witness these character grappling with such heaviness and confusion. and i related to this kind of confusion, grappling, stumbling through life, specifically in such the beginning of adulthood, trying to figure things out but things are not going in the same way as you would imagine in your head... learning to live not just as an individual, which is hard in itself but also adding other people into the equation, romantic or platonic relationships. 

plot wise, looking back it's not very simple but it's not overtly complex, felt like a nice balance, especially that it was moreso a character driven story. normally the whole story wrapping up in the last couple chapters would bother me, but pacing wise it felt okay? so not a bother in that sense. 

in such, the morally grey, confusing, frustrating characters, i enjoyed this read as they tried to navigate their lives, mainly with each other. ", ,
58,a demon's guide to wooing a witch,sarah hawley,3.50,70.00%,432,"2,023",romance,paranormal,2024-09-02,2024-09-07,6.0,"i'm starting to slow down with this unintentional marathon of reading because of many library ebooks due within a couple weeks. this book was sorta fun? but some reason didn't have the pull that the first book in this series did for me, like it did not suck me in the same way and kinda needed to push myself to read to finish in time (with 4 hours to spare lol)

overall i think the main things i liked and disliked in this book is basically the same as the precursor to this book. characters are interesting with interesting complex backgrounds, navigating emotional journeys as well as real ones with familial and community dynamics. i really disliked, more specifically in this one, how the conflict climax, twist, and resolution essentially happened in the last 2 chapters, mind you this book has 33 chapters total. not to spoil anything but it really just gets dropped at the end and things felt very hastily put together. the author made some great characters and even plot/conflict things, but ""landing the plane"" so to speak, felt kinda like an emergency landing. things made it in the end, but execution was shaky.

fun paranormal/fantasy romance but also kinda mid uhm", ,
59,heir of fire,sarah j. maas,4.50,90.00%,565,"2,014",fantasy,teen/ya,2024-09-12,2024-09-20,9.0,"2nd read, as i'm re-reading the series for the first time just so i can remember what happens and finally read (and finish) tower of dawn and also read for the first time kingdom of ash.. crazy to think i first read this series about 10 years ago

i have a lot of thoughts swirling in my head but also no words coming out erm so this review might be all over the place

re-reading this book reminded me why i loved, and have it in my favorite book collection. the pacing and plot development felt solid, how we get tidbits peeled back, and the threeish main perspectives going back and forth, revealing pieces of the war to come that we get not fully in context, to only be realized later as things start to tie together. if i remember correctly, this is the first, in the series that really focuses on these shifting perspectives, telling whole stories with each of the sorta main three characters (dorian and chaol sorta share, though for most of the book it's in chaol's pov at the rifthold parts). i remembered things as i progressed in the story, so plot points weren't that surprisng to me, though how they happen i didn't remember how the certain plot point unfolded so the overall story-reading experience was not ruined from me remember certain things

i always enjoy character driven plots, even though this is a fantasy novel, which i feel tend to lean more on the plot and political aspects of the book rather than character development as the main focus. we get to see celeana's training arc as fae and the grief she starts to process and accept, not only the events of book 2 but also her past, with her family and during her time as an assassin for hire. 

this book we also get to meet manon, a character that i remember loving to read about, her as the sorta grey-area character given her position in this book in this war forming with the king of adarlan. though we see towards the end of this book, her forming her own thoughts and opinions in the matter foreshadowing the next books with her arc, i was still happy to read about her and her journey with abraxos.

probably like with many people, i would get a little disappointed whenever the chapter would end and we switch to the rifthold pov with chaol, dorian, and aedion. while interesting in some aspects, and despite it seeming like it would get into more politics of things being in the capital with the king, it really felt surface level and like typical ya kids, teens or people in their early 20's trying to do rebellion things but with not much information being told (that we may already know from the other perspectives) so it just feels... meh. lol 

overall i really do enjoy it, while reading it time would just fly by and get through a whole chunk. 

i started reading this after taking a break after finishing crown of midnight, only because my library ebook of queen of shadows arrived so i don't have to painstakingly wait for the next book after the cliffhanger that i thought i would get from finishing this book lol", ,
60,queen of shadows,sarah j. maas,5.00,100.00%,648,"2,015",fantasy,teen/ya,2024-09-21,2024-09-29,9.0,"wow it's about 9 years ago minus 2 months, since i last read this book.. ha. 
also just in time with 1.5 hours to spare with my library rental, finishing the about last half of the book in the past two days... 

but what a whirlwind 

i always remembered that the plot and character arcs in 4 and 5 of this series felt so strong and intense. and it was as good as i remembered. though i would say that in terms of layers, it's pretty solid against a more ""typical"" fantasy book, i can say now after reading brandon sanderson xdd but truly after all these years, i really do feel like it still holds well. the layers of plot, and the twists! how each layer gets peeled back and then another wrench gets thrown into the mix and adds a new dynamic not just plotwise with aelin retaking her homeland but also the different characters all spread out both sides wise and location. from how i remember the last time i read this book, i didn't really remember much of the plot. tidbits here and there, like something about lysandra, to the key moment at the end, and some of the bigger lore bombs still felt monumental due to my brain forgetting what happened aha

i don't even know what to say anymore, erm. but very fun, nervous because i do remember the cliffhanger from the next book, but excited to read the journey of aelin and her court :^)

o7 have to pause reading this series despite getting the next book soon.. i have 2 romances and also hero of ages back from the library to read... but i did get assassins blade from the library, so fun get to be back in the world again even though it's not a continuation.", ,
61,heartstopper: volume four,alice oseman,4.25,85.00%,384,"2,021",romance,teen/ya,2024-09-26,2024-09-30,5.0,"idk what to say but charlie and nick are cute but also the storyline was heartbreaking? is the best way i can describe it. even though i haven't personally experienced it, but hearing charlie's story more in this volume was sad and i feel sympathetic towards him.. but i'm glad he's changing his perspective in terms of himself for the better.", ,
62,daydream,hannah grace,3.75,75.00%,448,"2,024",romance,sports,2024-09-30,2024-10-07,8.0,"ah yes another book in this series that i read and will (if they keep going) continue to read even though they are… lowkey kinda mid. yes the character arcs were enjoyable but man, it really felt directionless in terms of plot, even if romance novels tend to have more character-driven plot lines. 

so first, more on the plot. it really felt like we weren’t even in the car to go anywhere. i really felt that directionless feeling as i was reading, making it hard to stay focused on the story. the closest connection i could make it that this more meandering storytelling was reflective of henry’s (and sorta halle’s) internal battles, which i guess?? the closest other thing i can think of was the premise being plot-ish with henry needing to pass thorton’s class and halle needing experiences for her book, but that olotline wrapped up midway through the book… so yeah. i need some semblance of a plot in a book even with a romance book. 

i think on top of that, we get teased with friends group dynamics despite the fact that one of halle’s biggest regret? fear? is that she has no friends. that’s wasn’t a big of a thing in the book as i thought it would be, as halle and henry mostly spend time just by themselves and the respective friend groups show up only here and there. as someone who really enjoys friend dynamics in books, this was a disappointing aspect, especially when it was a bigger element in the other books (icebreakers & wildfire). 

overall it was fun but it fell more flat in some aspects. but yet, i enjoyed the more serious/mature topics of adhd and eldest daughter syndrome for henry and halle respectively. 
", ,
63,the ex vows,jessica joyce,4.25,85.00%,399,"2,024",romance,small-town,2024-10-10,2024-10-16,7.0,"whoops i forgot to write a review this morning since i finished reading this book before bed lol

but i really enjoyed this one. yes the miscommunication is strong but i felt like it made sense with the conflict of the main story, as the mc and ml had strong insecurities and anxieties with abandonment (though ml was slightly different with financial security related). probably because this was the main conflict, georgia's constant fear of her friends leaving her or drifting apart, is/was a very real fear or insecurity that i had/sorta still have. 

also i love friend group dynamics and wedding planning trope so this was a blast, even if there was rom-com level chaos happening with fires, cancelations, and rain lol. i can see why it would get annoying for others when reading it, but weirdly was fun? and like wanting to see how georgia and eli navigate through the chaos to salvage adam and grace's wedding. 

my brain is kinda fuzzy on more things but yes this was fun and i liked it and yes it made me cry, probably because i'm pms-ing but also the topics about drifting friendships happening in life, and becoming more of a real thing in your 20's felt all too real", ,
64,heartstopper: volume five,alice oseman,4.00,80.00%,336,"2,023",romance,teen/ya,2024-10-22,2024-10-22,1.0,"picked this up, a. to continue the series, especially now that the last volume is currently updating (and will have to probably wait until it finishes or mostly finishes because waiting inbetween updates is rough for me lol) and b. a half-hearted attempt at my tenative goal of reading 100 books this year. i've never done it before and i've always wanted to. and this year was the year that i really got to branch out and do things that i've been meaning to do but never did. (even though i've ticked off like three-four things out of a gajillion xd)

this, like the rest of this series, was very cute and heartwarming. and i really feel sad/happy for charlie, especially in retrospect to all the tumultuous things that has happened in his life
", ,
65,the assassin's blade,sarah j. maas,4.25,85.00%,448,"2,014",fantasy,teen/ya,2024-10-07,2024-10-24,18.0,"second read through~ though my feelings are roughly the same since the first time.

all the tales of celaena sardothien, at least some of the wild ones that became legend feeling, those that referenced to in the books. the last two were just heartbreaking while the pirate lord and the desert ones were thrilling to read. 

average rating: 4.2
overall rating: 4.25

—-
individual reviews/thoughts:

the pirate lord
ah yes the somewhat infamous story about captain rolfe.. a solid fun one
4.25 stars

the healer
interesting story but after reading the pirate lord this one was less intense with the storyline
3.75 stars

the desert
a classic one. really enjoy and it’s been long enough that i forgot about the twist. 
4.5 stars

the underworld
one of the more bittersweet ones, as celaena realizes the web she’s in, with arobynn’s abuse and manipulation. still good though, the continuation? or start of her relationship with sam. 
4.25 stars

the empire
oof. an intense one. the end of the beginning. how sam and celaena were betrayed and how she ended up in the salt mines in the beginning of throne of glass. 
4.25 stars", ,
66,maus: a survivor's tale ii: and here my troubles began,art spiegelman,4.00,80.00%,144,"1,991",memoir,historical,2023-01-24,2024-10-25,641.0,"after a long time of reading this on and off, i finally sat down and finished it..

it's definitely an interesting story, especially the unique way of portraying the war, using cat and mouse type of metaphor. probably due to my fascination with this time period, has me enjoying this more? 

maybe in the future i should read them more closely back to back, as the details of the first volume is sort of hazy as it's been three years since i finished the first one, and nearly two years since i've started this volume. 

idk what else to say, it's been two years since i read the first half of this and only now reading the second half so even my memories is hazy lol", ,
